{
  "type": "object",
  "required": [
    "https://app.chizhik.club/api/v1",
    "https://app.chizhik.club/api/v1/catalog/unauthorized/active_inout/",
    "https://app.chizhik.club/api/v1/catalog/unauthorized/categories/",
    "https://app.chizhik.club/api/v1/catalog/unauthorized/products/1055/",
    "https://app.chizhik.club/api/v1/catalog/unauthorized/products/?page=1&category_id=133&term=%D0%BA%D0%BE%D0%BB%D0%B0",
    "https://app.chizhik.club/api/v1/geo/cities/",
    "https://app.chizhik.club/api/v1/geo/cities/?name=%D0%B0%D1%80&page=1",
    "https://app.chizhik.club/api/v1/geo/cities/?utm_referrer=https%3a%2f%2fchizhik.club%2f",
    "https://app.chizhik.club/api/v1/services/ping/",
    "https://app.chizhik.club/api/v1/services/ping/?utm_referrer=https%3a%2f%2fchizhik.club%2f",
    "https://app.chizhik.club/api/v1/shops",
    "https://app.chizhik.club/api/v1/shops/",
    "https://app.chizhik.club/api/v1/shops/?term=%D0%9C%D0%BE%D1%81%D0%BA%D0%B2%D0%B0",
    "https://app.chizhik.club/api/v1/shops?term=%D0%9C%D0%BE%D1%81%D0%BA%D0%B2%D0%B0"
  ],
  "$schema": "https://json-schema.org/draft/2020-12/schema",
  "properties": {
    "https://app.chizhik.club/api/v1": {
      "type": "object",
      "required": [
        "accept",
        "accept-encoding",
        "accept-language",
        "connection",
        "cookie",
        "host",
        "sec-fetch-dest",
        "sec-fetch-mode",
        "sec-fetch-site",
        "sec-fetch-user",
        "upgrade-insecure-requests",
        "user-agent"
      ],
      "properties": {
        "accept": {
          "type": "string"
        },
        "accept-encoding": {
          "type": "string"
        },
        "accept-language": {
          "type": "string"
        },
        "connection": {
          "type": "string"
        },
        "cookie": {
          "type": "string"
        },
        "host": {
          "type": "string"
        },
        "sec-fetch-dest": {
          "type": "string"
        },
        "sec-fetch-mode": {
          "type": "string"
        },
        "sec-fetch-site": {
          "type": "string"
        },
        "sec-fetch-user": {
          "type": "string"
        },
        "upgrade-insecure-requests": {
          "type": "string"
        },
        "user-agent": {
          "type": "string"
        }
      }
    },
    "https://app.chizhik.club/api/v1/catalog/unauthorized/active_inout/": {
      "type": "object",
      "required": [
        "accept",
        "accept-encoding",
        "accept-language",
        "connection",
        "cookie",
        "host",
        "referer",
        "sec-fetch-dest",
        "sec-fetch-mode",
        "sec-fetch-site",
        "user-agent"
      ],
      "properties": {
        "accept": {
          "type": "string"
        },
        "accept-encoding": {
          "type": "string"
        },
        "accept-language": {
          "type": "string"
        },
        "connection": {
          "type": "string"
        },
        "cookie": {
          "type": "string"
        },
        "host": {
          "type": "string"
        },
        "referer": {
          "type": "string",
          "format": "uri"
        },
        "sec-fetch-dest": {
          "type": "string"
        },
        "sec-fetch-mode": {
          "type": "string"
        },
        "sec-fetch-site": {
          "type": "string"
        },
        "user-agent": {
          "type": "string"
        }
      }
    },
    "https://app.chizhik.club/api/v1/catalog/unauthorized/categories/": {
      "type": "object",
      "required": [
        "accept",
        "accept-encoding",
        "accept-language",
        "connection",
        "cookie",
        "host",
        "referer",
        "sec-fetch-dest",
        "sec-fetch-mode",
        "sec-fetch-site",
        "user-agent"
      ],
      "properties": {
        "accept": {
          "type": "string"
        },
        "accept-encoding": {
          "type": "string"
        },
        "accept-language": {
          "type": "string"
        },
        "connection": {
          "type": "string"
        },
        "cookie": {
          "type": "string"
        },
        "host": {
          "type": "string"
        },
        "referer": {
          "type": "string",
          "format": "uri"
        },
        "sec-fetch-dest": {
          "type": "string"
        },
        "sec-fetch-mode": {
          "type": "string"
        },
        "sec-fetch-site": {
          "type": "string"
        },
        "user-agent": {
          "type": "string"
        }
      }
    },
    "https://app.chizhik.club/api/v1/catalog/unauthorized/products/1055/": {
      "type": "object",
      "required": [
        "accept",
        "accept-encoding",
        "accept-language",
        "connection",
        "cookie",
        "host",
        "referer",
        "sec-fetch-dest",
        "sec-fetch-mode",
        "sec-fetch-site",
        "user-agent"
      ],
      "properties": {
        "accept": {
          "type": "string"
        },
        "accept-encoding": {
          "type": "string"
        },
        "accept-language": {
          "type": "string"
        },
        "connection": {
          "type": "string"
        },
        "cookie": {
          "type": "string"
        },
        "host": {
          "type": "string"
        },
        "referer": {
          "type": "string",
          "format": "uri"
        },
        "sec-fetch-dest": {
          "type": "string"
        },
        "sec-fetch-mode": {
          "type": "string"
        },
        "sec-fetch-site": {
          "type": "string"
        },
        "user-agent": {
          "type": "string"
        }
      }
    },
    "https://app.chizhik.club/api/v1/catalog/unauthorized/products/?page=1&category_id=133&term=%D0%BA%D0%BE%D0%BB%D0%B0": {
      "type": "object",
      "required": [
        "accept",
        "accept-encoding",
        "accept-language",
        "connection",
        "cookie",
        "host",
        "referer",
        "sec-fetch-dest",
        "sec-fetch-mode",
        "sec-fetch-site",
        "user-agent"
      ],
      "properties": {
        "accept": {
          "type": "string"
        },
        "accept-encoding": {
          "type": "string"
        },
        "accept-language": {
          "type": "string"
        },
        "connection": {
          "type": "string"
        },
        "cookie": {
          "type": "string"
        },
        "host": {
          "type": "string"
        },
        "referer": {
          "type": "string",
          "format": "uri"
        },
        "sec-fetch-dest": {
          "type": "string"
        },
        "sec-fetch-mode": {
          "type": "string"
        },
        "sec-fetch-site": {
          "type": "string"
        },
        "user-agent": {
          "type": "string"
        }
      }
    },
    "https://app.chizhik.club/api/v1/geo/cities/": {
      "type": "object",
      "required": [
        "accept",
        "accept-encoding",
        "accept-language",
        "connection",
        "host",
        "origin",
        "referer",
        "user-agent"
      ],
      "properties": {
        "accept": {
          "type": "string"
        },
        "accept-encoding": {
          "type": "string"
        },
        "accept-language": {
          "type": "string"
        },
        "connection": {
          "type": "string"
        },
        "host": {
          "type": "string"
        },
        "origin": {
          "type": "string",
          "format": "uri"
        },
        "referer": {
          "type": "string",
          "format": "uri"
        },
        "user-agent": {
          "type": "string"
        }
      }
    },
    "https://app.chizhik.club/api/v1/geo/cities/?name=%D0%B0%D1%80&page=1": {
      "type": "object",
      "required": [
        "accept",
        "accept-encoding",
        "accept-language",
        "connection",
        "cookie",
        "host",
        "referer",
        "sec-fetch-dest",
        "sec-fetch-mode",
        "sec-fetch-site",
        "user-agent"
      ],
      "properties": {
        "accept": {
          "type": "string"
        },
        "accept-encoding": {
          "type": "string"
        },
        "accept-language": {
          "type": "string"
        },
        "connection": {
          "type": "string"
        },
        "cookie": {
          "type": "string"
        },
        "host": {
          "type": "string"
        },
        "referer": {
          "type": "string",
          "format": "uri"
        },
        "sec-fetch-dest": {
          "type": "string"
        },
        "sec-fetch-mode": {
          "type": "string"
        },
        "sec-fetch-site": {
          "type": "string"
        },
        "user-agent": {
          "type": "string"
        }
      }
    },
    "https://app.chizhik.club/api/v1/geo/cities/?utm_referrer=https%3a%2f%2fchizhik.club%2f": {
      "type": "object",
      "required": [
        "accept",
        "accept-encoding",
        "accept-language",
        "connection",
        "host",
        "origin",
        "referer",
        "user-agent"
      ],
      "properties": {
        "accept": {
          "type": "string"
        },
        "accept-encoding": {
          "type": "string"
        },
        "accept-language": {
          "type": "string"
        },
        "connection": {
          "type": "string"
        },
        "host": {
          "type": "string"
        },
        "origin": {
          "type": "string",
          "format": "uri"
        },
        "referer": {
          "type": "string",
          "format": "uri"
        },
        "user-agent": {
          "type": "string"
        }
      }
    },
    "https://app.chizhik.club/api/v1/services/ping/": {
      "type": "object",
      "required": [
        "accept",
        "accept-encoding",
        "accept-language",
        "connection",
        "host",
        "origin",
        "referer",
        "user-agent"
      ],
      "properties": {
        "accept": {
          "type": "string"
        },
        "accept-encoding": {
          "type": "string"
        },
        "accept-language": {
          "type": "string"
        },
        "connection": {
          "type": "string"
        },
        "host": {
          "type": "string"
        },
        "origin": {
          "type": "string",
          "format": "uri"
        },
        "referer": {
          "type": "string",
          "format": "uri"
        },
        "user-agent": {
          "type": "string"
        }
      }
    },
    "https://app.chizhik.club/api/v1/services/ping/?utm_referrer=https%3a%2f%2fchizhik.club%2f": {
      "type": "object",
      "required": [
        "accept",
        "accept-encoding",
        "accept-language",
        "connection",
        "host",
        "origin",
        "referer",
        "user-agent"
      ],
      "properties": {
        "accept": {
          "type": "string"
        },
        "accept-encoding": {
          "type": "string"
        },
        "accept-language": {
          "type": "string"
        },
        "connection": {
          "type": "string"
        },
        "host": {
          "type": "string"
        },
        "origin": {
          "type": "string",
          "format": "uri"
        },
        "referer": {
          "type": "string",
          "format": "uri"
        },
        "user-agent": {
          "type": "string"
        }
      }
    },
    "https://app.chizhik.club/api/v1/shops": {
      "type": "object",
      "required": [
        "accept",
        "accept-encoding",
        "accept-language",
        "connection",
        "cookie",
        "host",
        "referer",
        "sec-fetch-dest",
        "sec-fetch-mode",
        "sec-fetch-site",
        "user-agent"
      ],
      "properties": {
        "accept": {
          "type": "string"
        },
        "accept-encoding": {
          "type": "string"
        },
        "accept-language": {
          "type": "string"
        },
        "connection": {
          "type": "string"
        },
        "cookie": {
          "type": "string"
        },
        "host": {
          "type": "string"
        },
        "referer": {
          "type": "string",
          "format": "uri"
        },
        "sec-fetch-dest": {
          "type": "string"
        },
        "sec-fetch-mode": {
          "type": "string"
        },
        "sec-fetch-site": {
          "type": "string"
        },
        "user-agent": {
          "type": "string"
        }
      }
    },
    "https://app.chizhik.club/api/v1/shops/": {
      "type": "object",
      "required": [
        "accept",
        "accept-encoding",
        "accept-language",
        "connection",
        "cookie",
        "host",
        "referer",
        "user-agent"
      ],
      "properties": {
        "accept": {
          "type": "string"
        },
        "accept-encoding": {
          "type": "string"
        },
        "accept-language": {
          "type": "string"
        },
        "connection": {
          "type": "string"
        },
        "cookie": {
          "type": "string"
        },
        "host": {
          "type": "string"
        },
        "referer": {
          "type": "string",
          "format": "uri"
        },
        "user-agent": {
          "type": "string"
        }
      }
    },
    "https://app.chizhik.club/api/v1/shops/?term=%D0%9C%D0%BE%D1%81%D0%BA%D0%B2%D0%B0": {
      "type": "object",
      "required": [
        "accept",
        "accept-encoding",
        "accept-language",
        "connection",
        "cookie",
        "host",
        "referer",
        "user-agent"
      ],
      "properties": {
        "accept": {
          "type": "string"
        },
        "accept-encoding": {
          "type": "string"
        },
        "accept-language": {
          "type": "string"
        },
        "connection": {
          "type": "string"
        },
        "cookie": {
          "type": "string"
        },
        "host": {
          "type": "string"
        },
        "referer": {
          "type": "string",
          "format": "uri"
        },
        "user-agent": {
          "type": "string"
        }
      }
    },
    "https://app.chizhik.club/api/v1/shops?term=%D0%9C%D0%BE%D1%81%D0%BA%D0%B2%D0%B0": {
      "type": "object",
      "required": [
        "accept",
        "accept-encoding",
        "accept-language",
        "connection",
        "cookie",
        "host",
        "referer",
        "sec-fetch-dest",
        "sec-fetch-mode",
        "sec-fetch-site",
        "user-agent"
      ],
      "properties": {
        "accept": {
          "type": "string"
        },
        "accept-encoding": {
          "type": "string"
        },
        "accept-language": {
          "type": "string"
        },
        "connection": {
          "type": "string"
        },
        "cookie": {
          "type": "string"
        },
        "host": {
          "type": "string"
        },
        "referer": {
          "type": "string",
          "format": "uri"
        },
        "sec-fetch-dest": {
          "type": "string"
        },
        "sec-fetch-mode": {
          "type": "string"
        },
        "sec-fetch-site": {
          "type": "string"
        },
        "user-agent": {
          "type": "string"
        }
      }
    }
  }
}